{
  "$schema": "http://json-schema.org/draft-07/schema#",
  "$id": "https://cairn/schemas/codex-plugin.schema.json",
  "title": "Codex Plugin Manifest",
  "description": "Schema for Codex plugin manifests",
  "type": "object",
  "required": ["name", "version", "description", "author", "interface"],
  "properties": {
    "name": {
      "type": "string",
      "pattern": "^[a-z][a-z0-9-]*$"
    },
    "version": { "type": "string" },
    "description": { "type": "string" },
    "author": {
      "type": "object",
      "required": ["name"],
      "properties": {
        "name": { "type": "string" },
        "email": { "type": "string" },
        "url": { "type": "string" }
      }
    },
    "homepage": { "type": "string" },
    "repository": { "type": "string" },
    "license": { "type": "string" },
    "keywords": {
      "type": "array",
      "items": { "type": "string" }
    },
    "skills": { "type": "string" },
    "hooks": { "type": "string" },
    "mcpServers": { "type": "string" },
    "interface": {
      "type": "object",
      "required": [
        "displayName",
        "shortDescription",
        "longDescription",
        "developerName",
        "category",
        "capabilities"
      ],
      "properties": {
        "displayName": { "type": "string" },
        "shortDescription": { "type": "string" },
        "longDescription": { "type": "string" },
        "developerName": { "type": "string" },
        "category": { "type": "string" },
        "capabilities": {
          "type": "array",
          "items": { "type": "string" }
        },
        "websiteURL": { "type": "string" },
        "defaultPrompt": {
          "type": "array",
          "maxItems": 3,
          "items": { "type": "string" }
        },
        "brandColor": { "type": "string" }
      }
    }
  }
}
