{
  "name": "codebase-ai-readiness",
  "version": "0.1.0",
  "description": "Assess how AI-friendly a codebase is and produce an autonomy maturity map with scores, blockers, and a roadmap.",
  "author": {
    "name": "Autonomy Rails",
    "url": "https://github.com/krokoko/autonomy-rails"
  },
  "homepage": "https://github.com/krokoko/autonomy-rails",
  "repository": "https://github.com/krokoko/autonomy-rails",
  "license": "Apache-2.0",
  "keywords": [
    "readiness",
    "assessment",
    "maturity",
    "autonomy-levels",
    "diagnosis"
  ],
  "skills": "./skills/",
  "hooks": "./hooks/hooks.json",
  "interface": {
    "displayName": "Codebase AI Readiness",
    "shortDescription": "Score codebase AI readiness and recommend autonomy level upgrades.",
    "longDescription": "Assess structure, tests, CI, typing, documentation, and agent affordances; produce readiness reports and improvement roadmaps.",
    "developerName": "Autonomy Rails",
    "category": "Assessment",
    "capabilities": ["Read", "Bash", "Grep", "Glob"],
    "websiteURL": "https://github.com/krokoko/autonomy-rails",
    "defaultPrompt": [
      "How AI-friendly is this codebase?",
      "Assess readiness for autonomous coding agents.",
      "What should I improve to unlock more autonomy?"
    ],
    "brandColor": "#2563EB"
  }
}
